<?xml version="1.0" encoding="UTF-8" standalone="no" ?>
<Packages xmlns:xsi="http://www.w3.org/2001/XMLSchema-instance"
     xsi:noNamespaceSchemaLocation="../../../../../../../jodi_core/src/main/resources/jodi-packages.v1.1.xsd">
  
    <Package>
      <FolderCode>BulkLoadFILE_DWH_SRC</FolderCode>
      <PackageName>IKM_SQL_TO_FILE_APPEND_2S</PackageName>
      <PackageListItem>IKM_SQL_TO_FILE_APPEND_2S</PackageListItem>
     <After>
      <ExecProcedure><Name>DeleteCountryList</Name></ExecProcedure>
      </After>
     </Package>
  
 </Packages>