<?xml version="1.0" encoding="UTF-8" standalone="no" ?>
<Packages xmlns:xsi="http://www.w3.org/2001/XMLSchema-instance"
	xsi:noNamespaceSchemaLocation="../../../../../../../jodi_core/src/main/resources/jodi-packages.v1.1.xsd">
	<Package>
		<FolderCode>InitialORACLE_DWH_CON_CHINOOK</FolderCode>
		<PackageName>INITIALDWH_CON_CHINOOK</PackageName>
		<PackageListItem>PACKAGE_ALL</PackageListItem>
		<Before>
			<Variable>
				<Name>LOAD_UP_TO_DATE</Name>
	      		<Type>DECLARE</Type>
			</Variable>
			<Variable>
				<Name>LOAD_UP_TO_DATE</Name>
				<Type>REFRESH</Type>
			</Variable>
		</Before>
  </Package>
	<Package>
		<PackageName>TEST_MKDIR</PackageName>
		<FolderCode>InitialORACLE_DWH_CON_CHINOOK</FolderCode>
		<PackageListItem>PACKAGE_ALL</PackageListItem>
		<Before>
			<ExecCommand>
				<Name>OdiMkDir</Name>
				<Parameters>
					<Parameter>
						<Name>DIR</Name>
						<Value>/tmp/mkDir</Value>
					</Parameter>
				</Parameters>
			</ExecCommand>
		</Before>
	</Package>
</Packages>
