<?xml version="1.0" encoding="UTF-8" standalone="no" ?>
<Packages xmlns:xsi="http://www.w3.org/2001/XMLSchema-instance"
	xsi:noNamespaceSchemaLocation="../../../../../../../jodi_core/src/main/resources/jodi-packages.v1.1.xsd">
   <Package>
		<PackageName>INSTALL_JOURNAL</PackageName>
		<FolderCode>RealTimeORACLE_DWH_CON_CHINOOK</FolderCode>
		<PackageListItem></PackageListItem>
		<Before>
			<ModelCommand>
				<Name>INSTALL_JOURNAL</Name>
				<Model>model.source.code</Model>
				<ActionType>JOURNALIZE</ActionType>
				<CreateSubscribers>true</CreateSubscribers>
				<InstallJournalization>true</InstallJournalization>
			</ModelCommand>
		</Before>
	</Package>
	<Package>
		<PackageName>UNINSTALL_JOURNAL</PackageName>
		<FolderCode>RealTimeORACLE_DWH_CON_CHINOOK</FolderCode>
		<PackageListItem></PackageListItem>
		<Before>
		  <ModelCommand>
				<Name>UNINSTALL_JOURNAL</Name>
				<Model>model.source.code</Model>
				<ActionType>JOURNALIZE</ActionType>
				<DropSubscribers>true</DropSubscribers>
			</ModelCommand>
			<ModelCommand>
				<Name>UNINSTALL_JOURNAL</Name>
				<Model>model.source.code</Model>
				<ActionType>JOURNALIZE</ActionType>
				<UninstallJournalization>true</UninstallJournalization>
			</ModelCommand>
		</Before>
	</Package>
	<Package>
		<FolderCode>RealTimeORACLE_DWH_CON_CHINOOK</FolderCode>
		<PackageName>REALTIMEDWH_CON_CHINOOK</PackageName>
		<PackageListItem>PACKAGE_ALL</PackageListItem>
		<Before>
			<Variable>
				<Name>LOAD_UP_TO_DATE</Name>
	      <Type>REFRESH</Type>
			</Variable>
		</Before>
	</Package>
</Packages>
