<?xml version="1.0" encoding="UTF-8" standalone="no" ?>
<Packages xmlns:xsi="http://www.w3.org/2001/XMLSchema-instance"
          xsi:noNamespaceSchemaLocation="../../../../../../../jodi_core/src/main/resources/jodi-packages.v1.1.xsd">

    <Package>
        <FolderCode>BulkLoadORACLE_DWH_STG</FolderCode>
        <PackageName>PACKAGE_CREATION_TEST1</PackageName>
        <PackageListItem>P1</PackageListItem>
        <Failure>
            <Variable>
                <Name>TestVariable3</Name>
                <Type>REFRESH</Type>
            </Variable>
            <Variable>
                <Name>TestVariable2</Name>
                <Type>REFRESH</Type>
            </Variable>
            <Variable>
                <Name>TestVariable1</Name>
                <Type>REFRESH</Type>
            </Variable>
            <Variable>
                <Name>TestVariable1</Name>
                <Type>EVALUATE</Type>
                <Operator>=</Operator>
                <Value>TEST</Value>
            </Variable>
            <ExecProcedure>
                <Name>CREATE_PACKAGE_TEST_PROC</Name>
                <Label>CREATE_PACKAGE_TEST_PROC</Label>
                <Parameters>
                    <Parameter>
                        <Name>Option1</Name>
                        <Value>Option value from XML</Value>
                    </Parameter>
                </Parameters>
            </ExecProcedure>
        </Failure>
    </Package>

    <Package>
        <FolderCode>BulkLoadORACLE_DWH_STG</FolderCode>
        <PackageName>PACKAGE_CREATION_TEST3</PackageName>
        <PackageListItem>P3</PackageListItem>
    </Package>

    <Package>
        <FolderCode>BulkLoadORACLE_DWH_STG</FolderCode>
        <PackageName>PACKAGE_CREATION_TEST2</PackageName>
        <PackageListItem>P2</PackageListItem>
        <Before>
            <Variable>
                <Name>TestVariable2</Name>
                <Type>REFRESH</Type>
            </Variable>
        </Before>
        <After>
            <Variable>
                <Name>TestVariable3</Name>
                <Type>REFRESH</Type>
            </Variable>
        </After>
    </Package>

    <Package>
        <FolderCode>BulkLoadORACLE_DWH_STG</FolderCode>
        <PackageName>PACKAGE_CREATION_TEST_ORCHESTRATION</PackageName>
        <PackageListItem></PackageListItem>
        <Before>
            <ExecCommand>
                <Name>OdiSleep</Name>
                <Label>OdiSleep_Label</Label>
                <Parameters>
                    <Parameter>
                        <Name>DELAY</Name>
                        <Value>1234</Value>
                    </Parameter>
                </Parameters>
            </ExecCommand>
            <ExecCommand>
                <Name>OdiWaitForLogData</Name>
                <Label>OdiWaitForLogData_Label</Label>
                <Parameters>
                    <Parameter>
                        <Name>LSCHEMA</Name>
                        <Value>LSCHEMA</Value>
                    </Parameter>
                    <Parameter>
                        <Name>TABLE_NAME</Name>
                        <Value>TABLE_NAME</Value>
                    </Parameter>
                    <Parameter>
                        <Name>GLOBAL_ROWCOUNT</Name>
                        <Value>1</Value>
                    </Parameter>
                    <Parameter>
                        <Name>OPTIMIZED_WAIT</Name>
                        <Value>AUTO</Value>
                    </Parameter>
                    <Parameter>
                        <Name>POLLINT</Name>
                        <Value>1000</Value>
                    </Parameter>
                    <Parameter>
                        <Name>SUBSCRIBER_NAME</Name>
                        <Value>SUNOPSIS</Value>
                    </Parameter>
                </Parameters>
            </ExecCommand>
            <ExecProcedure>
                <Name>CREATE_PACKAGE_TEST_PROC</Name>
                <Label>CREATE_PACKAGE_TEST_PROC</Label>
                <Parameters>
                    <Parameter>
                        <Name>Option1</Name>
                        <Value>Option value from XML</Value>
                    </Parameter>
                </Parameters>
            </ExecProcedure>
            <ExecPackage>
                <Name>PACKAGE_CREATION_TEST1</Name>
            </ExecPackage>
            <ExecPackage>
                <Name>PACKAGE_CREATION_TEST2</Name>
            </ExecPackage>
            <ExecPackage>
                <Name>PACKAGE_CREATION_TEST3</Name>
                <Asynchronous>true</Asynchronous>
            </ExecPackage>
        </Before>
        <After>
            <Variable>
                <Name>TestVariable2</Name>
                <Type>REFRESH</Type>
            </Variable>
            <Variable>
                <Name>TestVariable3</Name>
                <Type>REFRESH</Type>
            </Variable>
            <Variable>
                <Name>TestVariable1</Name>
                <Type>EVALUATE</Type>
                <Operator>></Operator>
                <Value>TEST</Value>
            </Variable>
            <Variable>
                <Name>TestVariable1</Name>
                <Label>TestVariable1_label</Label>
                <Type>SET</Type>
                <SetOperator>ASSIGN</SetOperator>
                <Value>TEST</Value>
            </Variable>
            <Variable>
                <Name>TestVariable4</Name>
                <Type>SET</Type>
                <SetOperator>INCREMENT</SetOperator>
                <IncrementBy>5</IncrementBy>
            </Variable>
        </After>
        <GotoOnFinalSuccess>CREATE_PACKAGE_TEST_PROC</GotoOnFinalSuccess>
    </Package>

</Packages>